{
  "schemaVersion": "1.0.0",
  "id": "seed-rules",
  "version": "0.2.0",
  "status": "experimental-uncalibrated",
  "description": "Transparent preliminary priors for decomposing repository evidence into Equivalent Human Effort work items. These values are uncalibrated and intended for review, testing, and future teacher-label calibration.",
  "technologyBaselineYear": 2026,
  "itemSizing": {
    "minimumExpectedHours": 0.5,
    "targetExpectedHours": 4.0,
    "maximumExpectedHours": 8.0,
    "roundingIncrementHours": 0.25
  },
  "complexityFactors": {
    "routine": 0.85,
    "moderate": 1.0,
    "high": 1.25,
    "exceptional": 1.6
  },
  "provenanceConfidence": {
    "observed": 0.82,
    "measured": 0.88,
    "declaredAssumed": 0.72,
    "inferred": 0.62
  },
  "rules": [
    {
      "id": "specification-comprehension",
      "category": "specification-comprehension-and-domain-learning",
      "quantityUnit": "scope",
      "setupHours": 0.5,
      "lowFactor": 0.65,
      "highFactor": 1.65,
      "defaultConfidence": 0.55,
      "drivers": [
        {
          "name": "production-scopes",
          "tiers": [
            { "upTo": 4, "hoursPerUnit": 0.75 },
            { "upTo": 12, "hoursPerUnit": 0.45 },
            { "hoursPerUnit": 0.25 }
          ]
        },
        {
          "name": "semantic-families",
          "tiers": [
            { "upTo": 8, "hoursPerUnit": 0.2 },
            { "hoursPerUnit": 0.1 }
          ]
        }
      ]
    },
    {
      "id": "solution-coordination",
      "category": "repository-and-solution-setup",
      "quantityUnit": "boundary",
      "setupHours": 0.5,
      "lowFactor": 0.7,
      "highFactor": 1.5,
      "defaultConfidence": 0.76,
      "drivers": [
        { "name": "solutions", "tiers": [{ "hoursPerUnit": 1.0 }] },
        { "name": "workspaces", "tiers": [{ "hoursPerUnit": 1.25 }] },
        {
          "name": "reference-edges",
          "tiers": [
            { "upTo": 10, "hoursPerUnit": 0.18 },
            { "hoursPerUnit": 0.08 }
          ]
        }
      ]
    },
    {
      "id": "project-setup",
      "category": "repository-and-solution-setup",
      "quantityUnit": "project-or-package",
      "setupHours": 0.5,
      "lowFactor": 0.7,
      "highFactor": 1.5,
      "defaultConfidence": 0.74,
      "drivers": [
        { "name": "scopes", "tiers": [{ "hoursPerUnit": 0.75 }] },
        { "name": "target-frameworks", "tiers": [{ "hoursPerUnit": 0.25 }] },
        {
          "name": "dependencies",
          "tiers": [
            { "upTo": 20, "hoursPerUnit": 0.04 },
            { "upTo": 100, "hoursPerUnit": 0.015 },
            { "hoursPerUnit": 0.005 }
          ]
        },
        {
          "name": "configuration-options",
          "tiers": [
            { "upTo": 20, "hoursPerUnit": 0.04 },
            { "hoursPerUnit": 0.015 }
          ]
        }
      ]
    },
    {
      "id": "architecture-design",
      "category": "architecture-and-technical-design",
      "quantityUnit": "scope",
      "setupHours": 0.5,
      "lowFactor": 0.6,
      "highFactor": 1.75,
      "defaultConfidence": 0.58,
      "drivers": [
        { "name": "production-scopes", "tiers": [{ "hoursPerUnit": 1.0 }] },
        {
          "name": "boundary-families",
          "tiers": [
            { "upTo": 8, "hoursPerUnit": 0.25 },
            { "hoursPerUnit": 0.12 }
          ]
        },
        {
          "name": "reference-edges",
          "tiers": [
            { "upTo": 12, "hoursPerUnit": 0.15 },
            { "hoursPerUnit": 0.06 }
          ]
        }
      ]
    },
    {
      "id": "recreation-design",
      "category": "architecture-and-technical-design",
      "quantityUnit": "decision-surface",
      "setupHours": 0.75,
      "lowFactor": 0.5,
      "highFactor": 2.0,
      "defaultConfidence": 0.45,
      "drivers": [
        {
          "name": "decision-surfaces",
          "tiers": [
            { "upTo": 6, "hoursPerUnit": 0.65 },
            { "upTo": 20, "hoursPerUnit": 0.35 },
            { "hoursPerUnit": 0.15 }
          ]
        }
      ]
    },
    {
      "id": "dotnet-source-backbone",
      "category": "production-implementation",
      "quantityUnit": "construction-point",
      "setupHours": 0.25,
      "lowFactor": 0.6,
      "highFactor": 1.7,
      "defaultConfidence": 0.68,
      "drivers": [
        { "name": "files", "tiers": [{ "upTo": 20, "hoursPerUnit": 0.08 }, { "upTo": 200, "hoursPerUnit": 0.04 }, { "hoursPerUnit": 0.02 }] },
        { "name": "types", "tiers": [{ "upTo": 50, "hoursPerUnit": 0.35 }, { "upTo": 500, "hoursPerUnit": 0.22 }, { "hoursPerUnit": 0.12 }] },
        { "name": "public-types", "tiers": [{ "upTo": 100, "hoursPerUnit": 0.15 }, { "hoursPerUnit": 0.08 }] },
        { "name": "methods", "tiers": [{ "upTo": 200, "hoursPerUnit": 0.2 }, { "upTo": 1000, "hoursPerUnit": 0.12 }, { "hoursPerUnit": 0.07 }] },
        { "name": "public-methods", "tiers": [{ "upTo": 300, "hoursPerUnit": 0.08 }, { "hoursPerUnit": 0.04 }] },
        { "name": "async-methods", "tiers": [{ "upTo": 100, "hoursPerUnit": 0.12 }, { "hoursPerUnit": 0.07 }] },
        { "name": "branch-points", "tiers": [{ "upTo": 200, "hoursPerUnit": 0.1 }, { "upTo": 1200, "hoursPerUnit": 0.06 }, { "hoursPerUnit": 0.03 }] }
      ]
    },
    {
      "id": "javascript-source-backbone",
      "category": "production-implementation",
      "quantityUnit": "construction-point",
      "setupHours": 0.25,
      "lowFactor": 0.55,
      "highFactor": 1.8,
      "defaultConfidence": 0.62,
      "drivers": [
        { "name": "files", "tiers": [{ "upTo": 20, "hoursPerUnit": 0.08 }, { "upTo": 200, "hoursPerUnit": 0.04 }, { "hoursPerUnit": 0.02 }] },
        { "name": "functions", "tiers": [{ "upTo": 200, "hoursPerUnit": 0.2 }, { "upTo": 1000, "hoursPerUnit": 0.12 }, { "hoursPerUnit": 0.07 }] },
        { "name": "methods", "tiers": [{ "upTo": 200, "hoursPerUnit": 0.16 }, { "upTo": 1000, "hoursPerUnit": 0.1 }, { "hoursPerUnit": 0.06 }] },
        { "name": "classes", "tiers": [{ "upTo": 100, "hoursPerUnit": 0.35 }, { "hoursPerUnit": 0.2 }] },
        { "name": "interfaces", "tiers": [{ "upTo": 150, "hoursPerUnit": 0.14 }, { "hoursPerUnit": 0.07 }] },
        { "name": "type-aliases", "tiers": [{ "upTo": 200, "hoursPerUnit": 0.1 }, { "hoursPerUnit": 0.05 }] },
        { "name": "enums", "tiers": [{ "upTo": 100, "hoursPerUnit": 0.2 }, { "hoursPerUnit": 0.1 }] },
        { "name": "async-functions", "tiers": [{ "upTo": 100, "hoursPerUnit": 0.12 }, { "hoursPerUnit": 0.07 }] },
        { "name": "branch-points", "tiers": [{ "upTo": 200, "hoursPerUnit": 0.1 }, { "upTo": 1200, "hoursPerUnit": 0.06 }, { "hoursPerUnit": 0.03 }] },
        { "name": "exports", "tiers": [{ "upTo": 200, "hoursPerUnit": 0.04 }, { "hoursPerUnit": 0.015 }] },
        { "name": "dynamic-imports", "tiers": [{ "upTo": 50, "hoursPerUnit": 0.15 }, { "hoursPerUnit": 0.07 }] }
      ]
    },
    {
      "id": "application-entry-point",
      "category": "production-implementation",
      "quantityUnit": "entry-point",
      "setupHours": 0.25,
      "lowFactor": 0.7,
      "highFactor": 1.5,
      "defaultConfidence": 0.72,
      "drivers": [
        { "name": "entry-points", "tiers": [{ "upTo": 4, "hoursPerUnit": 0.75 }, { "hoursPerUnit": 0.5 }] }
      ]
    },
    {
      "id": "api-surface",
      "category": "production-implementation",
      "quantityUnit": "endpoint-or-operation",
      "setupHours": 0.5,
      "lowFactor": 0.55,
      "highFactor": 1.85,
      "defaultConfidence": 0.63,
      "drivers": [
        { "name": "endpoints", "tiers": [{ "upTo": 20, "hoursPerUnit": 0.85 }, { "upTo": 100, "hoursPerUnit": 0.55 }, { "hoursPerUnit": 0.3 }] },
        { "name": "controllers", "tiers": [{ "upTo": 20, "hoursPerUnit": 1.0 }, { "hoursPerUnit": 0.55 }] },
        { "name": "graphql-operations", "tiers": [{ "upTo": 20, "hoursPerUnit": 1.1 }, { "hoursPerUnit": 0.65 }] },
        { "name": "route-groups", "tiers": [{ "hoursPerUnit": 0.4 }] }
      ]
    },
    {
      "id": "ui-surface",
      "category": "ui-implementation-and-represented-ux-decisions",
      "quantityUnit": "ui-surface",
      "setupHours": 0.5,
      "lowFactor": 0.5,
      "highFactor": 1.95,
      "defaultConfidence": 0.58,
      "drivers": [
        { "name": "pages", "tiers": [{ "upTo": 20, "hoursPerUnit": 2.5 }, { "hoursPerUnit": 1.75 }] },
        { "name": "components", "tiers": [{ "upTo": 20, "hoursPerUnit": 1.25 }, { "upTo": 100, "hoursPerUnit": 0.8 }, { "hoursPerUnit": 0.45 }] },
        { "name": "ui-types", "tiers": [{ "upTo": 30, "hoursPerUnit": 1.5 }, { "hoursPerUnit": 0.8 }] },
        { "name": "forms", "tiers": [{ "upTo": 30, "hoursPerUnit": 1.0 }, { "hoursPerUnit": 0.6 }] },
        { "name": "state-usages", "tiers": [{ "upTo": 20, "hoursPerUnit": 0.5 }, { "hoursPerUnit": 0.25 }] },
        { "name": "effect-usages", "tiers": [{ "upTo": 50, "hoursPerUnit": 0.2 }, { "hoursPerUnit": 0.1 }] },
        { "name": "component-parameters", "tiers": [{ "upTo": 100, "hoursPerUnit": 0.12 }, { "hoursPerUnit": 0.05 }] },
        { "name": "commands", "tiers": [{ "upTo": 30, "hoursPerUnit": 0.75 }, { "hoursPerUnit": 0.4 }] },
        { "name": "asset-files", "tiers": [{ "upTo": 20, "hoursPerUnit": 0.45 }, { "hoursPerUnit": 0.25 }] },
        { "name": "asset-lines", "tiers": [{ "upTo": 1000, "hoursPerUnit": 0.004 }, { "hoursPerUnit": 0.0015 }] }
      ]
    },
    {
      "id": "data-persistence",
      "category": "data-modeling-persistence-and-migrations",
      "quantityUnit": "data-surface",
      "setupHours": 1.0,
      "lowFactor": 0.55,
      "highFactor": 1.85,
      "defaultConfidence": 0.62,
      "drivers": [
        { "name": "db-contexts", "tiers": [{ "hoursPerUnit": 3.0 }] },
        { "name": "db-sets", "tiers": [{ "upTo": 30, "hoursPerUnit": 1.2 }, { "hoursPerUnit": 0.8 }] },
        { "name": "migrations", "tiers": [{ "upTo": 20, "hoursPerUnit": 1.0 }, { "hoursPerUnit": 0.6 }] },